{
  "$schema": "https://json-schema.org/draft/2020-12/schema",
  "$id": "https://project-relay.dev/schemas/evidence.schema.json",
  "title": "Relay Evidence Bundle",
  "type": "object",
  "additionalProperties": false,
  "required": [
    "schema_version",
    "id",
    "task_id",
    "producer",
    "created_at",
    "claim",
    "method",
    "commands",
    "environment",
    "artifacts",
    "failures",
    "limitations",
    "status"
  ],
  "properties": {
    "schema_version": { "const": "0.1.0" },
    "id": { "type": "string", "pattern": "^EVD-[A-Za-z0-9_-]{8,}$" },
    "task_id": { "type": "string", "pattern": "^[A-Z][A-Z0-9_-]{1,31}-[0-9]{4,}$" },
    "producer": { "$ref": "#/$defs/actor" },
    "created_at": { "type": "string", "format": "date-time" },
    "claim": { "type": "string", "minLength": 10, "maxLength": 5000 },
    "method": { "type": "string", "minLength": 10, "maxLength": 10000 },
    "commands": {
      "type": "array",
      "minItems": 1,
      "items": { "type": "string", "minLength": 1, "maxLength": 5000 }
    },
    "environment": {
      "type": "object",
      "additionalProperties": false,
      "required": ["runtime", "platform", "dependencies"],
      "properties": {
        "runtime": { "type": "string", "minLength": 1, "maxLength": 300 },
        "platform": { "type": "string", "minLength": 1, "maxLength": 300 },
        "dependencies": {
          "type": "object",
          "additionalProperties": { "type": "string", "minLength": 1, "maxLength": 200 }
        },
        "container_digest": { "type": "string", "maxLength": 500 }
      }
    },
    "artifacts": {
      "type": "array",
      "minItems": 1,
      "items": {
        "type": "object",
        "additionalProperties": false,
        "required": ["uri", "sha256", "media_type"],
        "properties": {
          "uri": { "type": "string", "minLength": 1, "maxLength": 2000 },
          "sha256": { "type": "string", "pattern": "^[a-f0-9]{64}$" },
          "media_type": { "type": "string", "minLength": 1, "maxLength": 200 },
          "size_bytes": { "type": "integer", "minimum": 0 }
        }
      }
    },
    "failures": {
      "type": "array",
      "items": { "type": "string", "minLength": 1, "maxLength": 2000 }
    },
    "limitations": {
      "type": "array",
      "items": { "type": "string", "minLength": 1, "maxLength": 2000 }
    },
    "status": { "enum": ["provisional", "reproduced", "audited", "rejected", "superseded"] }
  },
  "$defs": {
    "actor": {
      "type": "object",
      "additionalProperties": false,
      "required": ["id", "type", "role"],
      "properties": {
        "id": { "type": "string", "pattern": "^[A-Za-z0-9][A-Za-z0-9._:@/-]{1,127}$" },
        "type": { "enum": ["human", "model", "service"] },
        "role": { "type": "string", "minLength": 2, "maxLength": 100 },
        "provider": { "type": "string", "minLength": 1, "maxLength": 100 },
        "model": { "type": "string", "minLength": 1, "maxLength": 200 }
      }
    }
  }
}
