{
  "schema_version": "0.1.0",
  "id": "EVD-m1remedied01",
  "task_id": "RELAY-1001",
  "producer": {
    "id": "model:builder",
    "type": "model",
    "role": "implementation"
  },
  "created_at": "2026-07-19T01:09:00Z",
  "claim": "The remediated synthetic result now satisfies both declared acceptance criteria.",
  "method": "Inspect the replacement synthetic artifact and verify that result and constraint-check are both complete.",
  "commands": [
    "node scripts/validate-repository.mjs examples/m1"
  ],
  "environment": {
    "runtime": "Node.js 24",
    "platform": "synthetic cross-platform fixture",
    "dependencies": {
      "project-relay": "0.1.0"
    }
  },
  "artifacts": [
    {
      "uri": "artifacts/remediated-result.txt",
      "sha256": "06a671f90d9687c3d7eac777f41b3d2e6fbfd05a92c481b42b967869609c3f5a",
      "media_type": "text/plain",
      "size_bytes": 42
    }
  ],
  "failures": [
    "The initial submission omitted the required constraint check."
  ],
  "limitations": [
    "This is a synthetic protocol fixture and does not establish scientific validity."
  ],
  "status": "provisional"
}
